{
  "schemaVersion": 1,
  "arch": "SFNN_ka2_2048_8_64_progress8",
  "model": {
    "id": "tuyouraou11micro-20261001-epoch0010-7f9545dbf73b-a2d18f056463",
    "nnSha256": "7f9545dbf73b87acf312146daabf59c4f17d0845c87d587fa19caed51707dddb",
    "progressSha256": "a2d18f0564639c945b5d6469e9b437cd64a526ad4fbcef02ab1d8f547d08e5f1"
  },
  "reference": {
    "repository": "https://github.com/yaneurao/YaneuraOu",
    "commit": "7d9743646f1006ff6d84da45d6d6160048a5a416",
    "command": [
      "python3",
      "scripts/tuyouraou11.py",
      "fixtures"
    ],
    "buildFlags": [
      "TARGET_CPU=OTHER",
      "COMPILER=g++",
      "PYTHON=python3",
      "YANEURAOU_EDITION=YANEURAOU_ENGINE_SFNN_ka2_2048_8_64_progress8"
    ],
    "fvScale": 24,
    "generator": "haitaka_wasm/examples/sfnn_positions.rs; LCG64 seed=1; sha256=3efb7a54e3d2becfef53183bf6f2cde6576f7cc241e7e022ec4f5e78d77d6798"
  },
  "cases": [
    {
      "id": "0:0",
      "sfen": "lnsgkgsnl/1r5b1/ppppppppp/9/9/9/PPPPPPPPP/1B5R1/LNSGKGSNL b - 1",
      "tags": [
        "black-to-move",
        "opening",
        "king-position"
      ],
      "progress": {
        "sumsQ16": {
          "black": "-110710",
          "white": "-110710"
        },
        "selectedSumQ16": "-221420",
        "bucket": 0
      },
      "evalCp": 52
    },
    {
      "id": "0:1",
      "sfen": "lnsgkgsnl/1r5b1/ppppppppp/9/9/9/PPPPPPPPP/1B3G1R1/LNSGK1SNL w - 2",
      "tags": [
        "white-to-move",
        "opening",
        "king-position"
      ],
      "progress": {
        "sumsQ16": {
          "black": "-110006",
          "white": "-108240"
        },
        "selectedSumQ16": "-218246",
        "bucket": 0
      },
      "evalCp": 16
    },
    {
      "id": "0:8",
      "sfen": "ln1g1g1nl/1rsk1s1b1/p1ppppppp/1p7/9/2P4P1/PPBPPPP1P/5G1R1/LNSGK1SNL b - 9",
      "tags": [
        "black-to-move",
        "opening",
        "king-position"
      ],
      "progress": {
        "sumsQ16": {
          "black": "-101366",
          "white": "-62019"
        },
        "selectedSumQ16": "-163385",
        "bucket": 0
      },
      "evalCp": 170
    },
    {
      "id": "0:9",
      "sfen": "ln1g1g1nl/1rsk1s1b1/p1ppppppp/1p7/9/2P4P1/PPBPPPP1P/5G2R/LNSGK1SNL w - 10",
      "tags": [
        "white-to-move",
        "opening",
        "king-position"
      ],
      "progress": {
        "sumsQ16": {
          "black": "-99815",
          "white": "-60558"
        },
        "selectedSumQ16": "-160373",
        "bucket": 0
      },
      "evalCp": 76
    },
    {
      "id": "0:16",
      "sfen": "ln1gs2nl/1rskg2b1/p1pp1p2p/1p2p1+Bp1/9/2P4P1/PP1PPPP1P/2S2G2R/LN1GK1SNL b P 17",
      "tags": [
        "black-to-move",
        "opening",
        "promoted-piece",
        "hand",
        "king-position"
      ],
      "progress": {
        "sumsQ16": {
          "black": "-79076",
          "white": "-46899"
        },
        "selectedSumQ16": "-125975",
        "bucket": 1
      },
      "evalCp": 631
    },
    {
      "id": "0:17",
      "sfen": "ln1gs2nl/1rskg2b1/p1pp1p2p/1p2p1+Bp1/9/2P4P1/PPNPPPP1P/2S2G2R/L2GK1SNL w P 18",
      "tags": [
        "white-to-move",
        "opening",
        "promoted-piece",
        "hand",
        "king-position"
      ],
      "progress": {
        "sumsQ16": {
          "black": "-75813",
          "white": "-45004"
        },
        "selectedSumQ16": "-120817",
        "bucket": 1
      },
      "evalCp": -635
    },
    {
      "id": "0:24",
      "sfen": "ln1gs2nl/1rskg2b1/p2p1p2p/1pp1p1+B2/7p1/P1P1P2P1/1PNP1PP1P/2SK1G2R/L2G2SNL b P 25",
      "tags": [
        "black-to-move",
        "opening",
        "promoted-piece",
        "hand",
        "king-position"
      ],
      "progress": {
        "sumsQ16": {
          "black": "-42017",
          "white": "-40527"
        },
        "selectedSumQ16": "-82544",
        "bucket": 1
      },
      "evalCp": 448
    },
    {
      "id": "0:25",
      "sfen": "ln1gs2nl/1rskg2b1/p2p1p1+Bp/1pp1p4/7p1/P1P1P2P1/1PNP1PP1P/2SK1G2R/L2G2SNL w P 26",
      "tags": [
        "white-to-move",
        "opening",
        "promoted-piece",
        "hand",
        "king-position"
      ],
      "progress": {
        "sumsQ16": {
          "black": "-44646",
          "white": "-39640"
        },
        "selectedSumQ16": "-84286",
        "bucket": 1
      },
      "evalCp": -317
    },
    {
      "id": "0:32",
      "sfen": "1n1gs2nl/lrsk5/p2pgp2p/1pp1p+B3/7p1/P1P1P2PP/1PNP1PP2/2SK1G2R/L2G2SNL b BP 33",
      "tags": [
        "black-to-move",
        "middlegame",
        "promoted-piece",
        "hand",
        "king-position"
      ],
      "progress": {
        "sumsQ16": {
          "black": "-36756",
          "white": "-29550"
        },
        "selectedSumQ16": "-66306",
        "bucket": 2
      },
      "evalCp": 968
    },
    {
      "id": "0:33",
      "sfen": "1n1gs2nl/lrsk5/p2pgp2p/1pp1p+B3/7p1/P1P1P2PP/1PNP1PP2/1BSK1G2R/L2G2SNL w P 34",
      "tags": [
        "white-to-move",
        "middlegame",
        "promoted-piece",
        "hand",
        "king-position"
      ],
      "progress": {
        "sumsQ16": {
          "black": "-40842",
          "white": "-34178"
        },
        "selectedSumQ16": "-75020",
        "bucket": 1
      },
      "evalCp": -342
    },
    {
      "id": "0:40",
      "sfen": "1n2s2n1/lr1kg3l/p2pgp2p/1ppsp1+B2/3N3p1/P1P1P2PP/1P1P1PP2/1BSK1G1R1/L2G2SNL b P 41",
      "tags": [
        "black-to-move",
        "middlegame",
        "promoted-piece",
        "hand",
        "king-position"
      ],
      "progress": {
        "sumsQ16": {
          "black": "-33013",
          "white": "-27028"
        },
        "selectedSumQ16": "-60041",
        "bucket": 2
      },
      "evalCp": 1247
    },
    {
      "id": "0:41",
      "sfen": "1n2s2n1/lr1kg2+Bl/p2pgp2p/1ppsp1+B2/3N3p1/P1P1P2PP/1P1P1PP2/2SK1G1R1/L2G2SNL w P 42",
      "tags": [
        "white-to-move",
        "middlegame",
        "promoted-piece",
        "hand",
        "king-position"
      ],
      "progress": {
        "sumsQ16": {
          "black": "-30879",
          "white": "-19967"
        },
        "selectedSumQ16": "-50846",
        "bucket": 2
      },
      "evalCp": -1338
    },
    {
      "id": "0:48",
      "sfen": "1n2s2n1/lr1k1g1+Bl/p2p1p2p/1p1s1g+B2/2pNP2p1/P1P4PP/1P1P1PP2/2SK1G2R/L1G3SNL b 2P 49",
      "tags": [
        "black-to-move",
        "middlegame",
        "promoted-piece",
        "hand",
        "king-position"
      ],
      "progress": {
        "sumsQ16": {
          "black": "-19981",
          "white": "-10347"
        },
        "selectedSumQ16": "-30328",
        "bucket": 3
      },
      "evalCp": 1254
    },
    {
      "id": "0:49",
      "sfen": "1n2s2n1/lr1k1g1+Bl/p2p1p2p/1p1s1g+B2/2pNP2p1/P1P4PP/1P1PKPP2/2S2G2R/L1G3SNL w 2P 50",
      "tags": [
        "white-to-move",
        "middlegame",
        "promoted-piece",
        "hand",
        "king-position"
      ],
      "progress": {
        "sumsQ16": {
          "black": "3690",
          "white": "-10347"
        },
        "selectedSumQ16": "-6657",
        "bucket": 3
      },
      "evalCp": -878
    },
    {
      "id": "0:56",
      "sfen": "1n2sg3/l3k2+Bl/pr1p1pn1p/1p1s1+B3/P1pNP2p1/2P4PP/1P1PKPP2/2S2G1R1/L1G3SNL b G2P 57",
      "tags": [
        "black-to-move",
        "middlegame",
        "promoted-piece",
        "hand",
        "king-position"
      ],
      "progress": {
        "sumsQ16": {
          "black": "3505",
          "white": "-16177"
        },
        "selectedSumQ16": "-12672",
        "bucket": 3
      },
      "evalCp": 1387
    },
    {
      "id": "0:57",
      "sfen": "1n2sg3/l3k2+Bl/pr1p1pn1p/1p1s1+B3/P1pNP2p1/1PP4PP/3PKPP2/2S2G1R1/L1G3SNL w G2P 58",
      "tags": [
        "white-to-move",
        "middlegame",
        "promoted-piece",
        "hand",
        "king-position"
      ],
      "progress": {
        "sumsQ16": {
          "black": "4668",
          "white": "-16901"
        },
        "selectedSumQ16": "-12233",
        "bucket": 3
      },
      "evalCp": -1653
    },
    {
      "id": "0:64",
      "sfen": "1n2sg3/l3k2+Bl/3psp2p/pr4+B2/PppNP2p1/1PP4PP/3PKPPG1/2S2G1R1/L1G3SNL b N2P 65",
      "tags": [
        "black-to-move",
        "middlegame",
        "promoted-piece",
        "hand",
        "king-position"
      ],
      "progress": {
        "sumsQ16": {
          "black": "7669",
          "white": "-28033"
        },
        "selectedSumQ16": "-20364",
        "bucket": 3
      },
      "evalCp": 1497
    },
    {
      "id": "0:65",
      "sfen": "1n2sg3/l3k2+Bl/3psp2p/pr4+B2/PppNP2p1/1PP4PP/1N1PKPPG1/2S2G1R1/L1G3SNL w 2P 66",
      "tags": [
        "white-to-move",
        "middlegame",
        "promoted-piece",
        "hand",
        "king-position"
      ],
      "progress": {
        "sumsQ16": {
          "black": "7311",
          "white": "-27930"
        },
        "selectedSumQ16": "-20619",
        "bucket": 3
      },
      "evalCp": -1709
    },
    {
      "id": "0:72",
      "sfen": "5g3/l2sks1+Bl/2np1p2p/pr4+B2/PppNP4/1PPK3pP/1NSP1PPG1/5GSR1/L1G4NL b 2Pp 73",
      "tags": [
        "black-to-move",
        "middlegame",
        "promoted-piece",
        "hand",
        "king-position"
      ],
      "progress": {
        "sumsQ16": {
          "black": "26644",
          "white": "-34243"
        },
        "selectedSumQ16": "-7599",
        "bucket": 3
      },
      "evalCp": 1210
    },
    {
      "id": "0:73",
      "sfen": "5g3/l2sks1+Bl/2np1p2p/pr4+B2/PppNP4/1PPK3pP/1NSP1PP1G/5GSR1/L1G4NL w 2Pp 74",
      "tags": [
        "white-to-move",
        "middlegame",
        "promoted-piece",
        "hand",
        "king-position"
      ],
      "progress": {
        "sumsQ16": {
          "black": "18681",
          "white": "-31791"
        },
        "selectedSumQ16": "-13110",
        "bucket": 3
      },
      "evalCp": -1052
    },
    {
      "id": "0:80",